Area,Key Info
Brand Name,Siebert
Website Link,https://www.siebert.com/
Long Description,"Siebert is a financial services company with a rich history dating back to 1967. Founded by Muriel Siebert, the first woman to own a seat on the New York Stock Exchange, the company has evolved into a strong, client-focused institution. Under the leadership of the Gebbia family since 2016, Siebert has experienced significant growth and continues to uphold Muriel's legacy of empowerment and financial freedom."
Short Description,Empowering financial freedom since 1967.
Target Audience,"Diverse range of investors, from millennials to high-net-worth individuals, veterans, and professional athletes."
Market Segment 1,Millennial Professionals
Market Segment 2,High-Achieving Women
Market Segment 3,Military Personnel (Active Duty and Veterans)
Product Category,"Financial services, including investment management, retirement planning, and wealth preservation."
Business Objective,To empower clients to achieve financial freedom and secure their financial future.
Seed Keywords,"Financial freedom, empowerment, investment, retirement planning, wealth management, legacy"
Tone of Voice,"Empowering, inclusive, aspirational. Confident and trustworthy, like a charismatic, knowledgeable friend."
Persona 1,"Rajesh Patel: 44-year-old male, tech professional, focus on retirement planning and education funding"
Persona 2,"Tara Li-Lewis: 39-year-old female, executive, focus on long-term wealth growth and work-life balance"
Persona 3,"Adrian Garcia: 37-year-old male, active duty military, focus on post-service retirement and TSP management"
Persona 4,"William Brown: 62-year-old male, veteran and corporate executive, focus on wealth growth and legacy planning"
Persona 5,"Connor Morgan: 24-year-old, Gen Z with generational wealth, focus on effective wealth management and inheritance planning"
Value Proposition,"Siebert empowers every individual to seize their financial dreams, following in the footsteps of our trailblazing founder."
Unique Selling Proposition 1,Legacy of empowerment: Founded by the first woman on the NYSE
Unique Selling Proposition 2,"Tailored solutions for diverse client needs, from millennials to high-net-worth individuals. We are for everyone."
Unique Selling Proposition 3,Strong focus on education and client empowerment
Unique Selling Proposition 4,Expertise in serving military personnel and veterans
USP Recap - Key Info,"Siebert combines a pioneering legacy with modern, tailored financial solutions and a strong commitment to client education and empowerment."
"❌ From Current State: pain points, problems, frustrations/fears","Lack of financial knowledge, complexity of investment options, fear of losing hard-earned money, time constraints for managing finances"
✅ To End State: Desires & Goals,"Financial freedom, secure retirement, funding children's education, growing and preserving wealth, leaving a legacy"
🛠 Benefits,"Expert guidance, tailored financial solutions, education and empowerment, long-term financial security"
Objections and Barriers,"""I can manage my own investments"", ""Is the cost worth it?"", ""I don't understand complex investment options"" ""Never head of Siebert - so many other known brands - why would I go to siebert?"""
Responses to Objections,"Emphasize education, tailored solutions, and long-term benefits of professional management"
FAQ / Frequently Asked Questions,[Not provided in the documents]
Behavioral Principles,"Empowerment, inclusivity, aspiration, confidence, trustworthiness"
Trigger Events,"Career transitions, family changes (marriage, children), approaching retirement, receiving inheritance"
Brand Why,To continue Muriel Siebert's legacy of breaking barriers and empowering individuals in their financial journeys
Brand Purpose / Mission,"Following in Muriel's footsteps, we empower every person who comes through our doors to seize their dream."
Brand Values,"Empowerment, inclusivity, financial free"
Main Offer,Comprehensive financial planning and investment management services
List of Optional Offers,"Retirement planning, education funding, tax-efficient investing, legacy planning"
Bonuses,"Educational resources, workshops, and webinars"
Guarantees,Guranteed to always get a real human on the phone
Product 1 - Investment:,"Investment: Siebert offers a wide range of investment options such as stocks, bonds, ETFs, mutual funds, and options. They provide tools for dividend reinvestment and access to IPOs and SPACs. They also offer specialized products like annuities, structured products, and TIPS for diverse investment strategies."
"Product 1 - Investment: 
❌ From Current State: pain points, problems, frustrations/fears",Siebert has been around for a long time but is not well known. A pain point for us is why go with us vs a large firm for investments. 
"Product 1 - Investment: 
✅ To End State: Desires & Goals",Our difference is: we have been doing this since 1967. We have the best of the best customer service and professionals with a ton of experience
Product 2 - Managed Portfolio (SiebertNXT Premiere):,Managed Portfolio (SiebertNXT): This service offers personalized investment management tailored to the client's financial goals and risk tolerance. Clients receive a detailed investment proposal and have access to a variety of managed account programs. The focus is on providing a hands-off investment experience where professionals handle daily management tasks.
"Product 2 - Managed Portfolio (SiebertNXT Premiere): 
❌ From Current State: pain points, problems, frustrations/fears",Siebert has been around for a long time but is not well known. A pain point for us is why go with us vs a large firm for managed portfolios. 
"Product 2 - Managed Portfolio (SiebertNXT Premiere): 
✅ To End State: Desires & Goals",We stick out because we are extremely easy accessible. We priotize relationships over anything else. It feels alot less transactional with us and we have a familu culture that is felt by our clients. We are still family run and owned
Product 3 - Financial Advice: ,Financial Advice: Siebert provides expert financial advice through licensed Wealth Managers who offer guidance tailored to individual needs. This service includes both strategic long-term planning and specific investment choices to help clients stay ahead in their financial journey.
"Product 3 - Financial Advice:  
❌ From Current State: pain points, problems, frustrations/fears",Our wealth managers 
"Product 3 - Financial Advice:  
✅ To End State: Desires & Goals","We have a great core group of experienced investment advisors who have in many cases 
been will1 chis ownership group for several decades. We've developed an in-house training 
program through which ll1ose advisors pass on the skill secs required co build our advisors 
of me future. We cake individuals into our training progran1 who ha,·e experience on the Street, and inclividuals who don'c. We've added people from sports and restaurant industries, and we've added ex-military people. We have found success in that route in 
managinggrowch slowdowns that come wich evems like Covid "
Product 4 - Insurance: ,"Insurance: Through its subsidiary, Park Wilshire Companies, Siebert offers a range of insurance products and annuity investments. This includes life insurance and other types of coverage that complement financial planning and risk management strategies."
"Product 4 - Insurance:  
❌ From Current State: pain points, problems, frustrations/fears",Siebert has been around for a long time but is not well known. A pain point for us is why go with us vs a large firm for insurance
"Product 4 - Insurance: 
✅ To End State: Desires & Goals",We are trusted to insure clients
Product 5 - Employee Share Plan:,Employee Share Plan: Siebert partners with public companies to offer share plan administration and services. This includes comprehensive management of stock plans which benefits both the companies and their employees by facilitating equity compensation programs.
"Product 5 - Employee Share Plan: 
❌ From Current State: pain points, problems, frustrations/fears",Siebert has been around for a long time but is not well known. A pain point for us is why go with us vs a large firm for employee stock plans
"Product 5 - Employee Share Plan: 
✅ To End State: Desires & Goals","Siebert prides itself on providing personal service regardless of the size and components of your stock plan. Siebert partners with your legal and admin teams to streamline processes for officers, executives, and insiders.We're truly here to support the needs of plan administrators and can provide a primary point of contact for participant inquiries.Protect yourself, your family, or your business from unforeseen life changes and obstacles. With Siebert's help, you can be prepared for the unexpected. adapts to each company's needs, ensuring efficient administration and a smooth experience for employees.
"